"Address","Occurrences","Meta Description 1","Meta Description 1 Length","Meta Description 1 Pixel Width","Indexability","Indexability Status"
"https://taxisaudiarabia.com/fleet/toyota-camry","1","Book a Toyota Camry in Saudi Arabia from SAR 80. Our most booked sedan for airport pickups and city rides. Clean, comfortable, and easy on the budget. Available 24/7 for airport transfers, Umrah, and intercity routes.","217","1343","Indexable",""
"https://taxisaudiarabia.com/driver-jobs/dhahran","1","Apply for driver jobs in Dhahran, Eastern Province. Earn SAR 4,000–9,500/month with steady pre-booked trips, flexible hours and weekly payouts. High demand.","156","989","Indexable",""
"https://taxisaudiarabia.com/routes/alkhobar-to-manama","1","Book a fixed-price taxi from Al Khobar to Manama, Bahrain — 50 km, approx 1h. From SAR 180, available 24/7 with licensed drivers. No surge, no hidden fees.","155","970","Indexable",""
"https://taxisaudiarabia.com/blog/madinah-to-makkah-taxi-price-distance-time","1","How far is Madinah from Makkah, how long does a taxi take, and what should you pay? A simple, up-to-date guide for Umrah pilgrims and families.","143","903","Indexable",""
"https://taxisaudiarabia.com/fleet/mercedes-sprinter","1","Book a Mercedes Sprinter in Saudi Arabia from SAR 300. High-roof van for large groups up to 14. Comfortable, spacious, and great for corporate travel. Available 24/7 for airport transfers, Umrah, and intercity routes.","217","1324","Indexable",""
"https://taxisaudiarabia.com/blog/madinah-taxi-fares-cost-guide","1","A clear 2026 breakdown of Madinah taxi prices — airport transfers from MED, Madinah to Makkah, Ziyarat tours, and return trips to Jeddah Airport. Fixed-price examples by vehicle.","178","1107","Indexable",""
"https://taxisaudiarabia.com/blog/makkah-to-madinah-taxi-journey-expectations","1","Traveling between the two Holy Cities by road is a popular choice. Here is everything you need to know about the 4-5 hour drive.","128","791","Indexable",""
"https://taxisaudiarabia.com/routes/riyadh-airport-to-city","1","Book a fixed-price taxi from Riyadh Airport to Riyadh City — 35 km, approx 1h. From SAR 100, available 24/7 with licensed drivers. No surge, no hidden fees.","156","959","Indexable",""
"https://taxisaudiarabia.com/routes/abha-airport-to-soudah","1","Book a fixed-price taxi from Abha Airport to Soudah — 45 km, approx 1h. From SAR 150, available 24/7 with licensed drivers. No surge, no hidden fees.","149","928","Indexable",""
"https://taxisaudiarabia.com/blog/car-towing-cost-saudi-arabia-2026","1","Real 2026 towing prices in Saudi Arabia — within-city satha rates in Riyadh, Jeddah and Dammam, intercity car transport costs, battery and tire callout fees, and how to avoid being overcharged.","193","1189","Indexable",""
"https://taxisaudiarabia.com/fleet/toyota-coaster","1","Book a Toyota Coaster in Saudi Arabia from SAR 500. Corporate bus for up to 17 — perfect for delegations, large groups, and Umrah operators. Available 24/7 for airport transfers, Umrah, and intercity routes.","207","1275","Indexable",""
"https://taxisaudiarabia.com/blog/jeddah-taxi-fares-cost-guide","1","A clear breakdown of Jeddah taxi prices in 2026 — airport transfers, Makkah and Madinah trips, city rides, and what affects the fare. Fixed-price examples by vehicle.","166","1015","Indexable",""
"https://taxisaudiarabia.com/routes/jeddah-to-neom","1","Book a fixed-price taxi from Jeddah to NEOM — 1000 km, approx 9h. From SAR 1100, available 24/7 with licensed drivers. No surge, no hidden fees.","144","912","Indexable",""
"https://taxisaudiarabia.com/fleet/ford-taurus","1","Book a Ford Taurus 2025 in Saudi Arabia from SAR 100. Reliable executive sedan with modern tech and a smooth ride for corporate travel. Available 24/7 for airport transfers, Umrah, and intercity routes.","202","1249","Indexable",""
"https://taxisaudiarabia.com/routes/madinah-to-riyadh","1","Book a fixed-price taxi from Madinah to Riyadh — 840 km, approx 8h. From SAR 550, available 24/7 with licensed drivers. No surge, no hidden fees.","145","906","Indexable",""
"https://taxisaudiarabia.com/services/car-recovery/makkah","1","24/7 car recovery & flatbed tow truck (سطحة مكة) in Makkah. Fast dispatch from SAR 250, fixed price on WhatsApp. Breakdown, accident & battery service across Makkah.","165","1039","Indexable",""
"https://taxisaudiarabia.com/routes/madinah-to-makkah","1","Book a fixed-price taxi from Madinah to Makkah — 430 km, approx 4h. From SAR 350, available 24/7 with licensed drivers. No surge, no hidden fees.","145","913","Indexable",""
"https://taxisaudiarabia.com/driver-jobs/tabuk","1","Apply for driver jobs in Tabuk, Tabuk Province. Earn SAR 4,000–10,000/month with steady pre-booked trips, flexible hours and weekly payouts. High demand.","153","975","Indexable",""
"https://taxisaudiarabia.com/routes/riyadh-to-manama","1","Book a fixed-price taxi from Riyadh to Manama, Bahrain — 450 km, approx 4h. From SAR 600, available 24/7 with licensed drivers. No surge, no hidden fees.","153","959","Indexable",""
"https://taxisaudiarabia.com/routes/makkah-to-jeddah-airport","1","Book a fixed-price taxi from Makkah to Jeddah Airport — 80 km, approx 1h. From SAR 180, available 24/7 with licensed drivers. No surge, no hidden fees.","151","944","Indexable",""
"https://taxisaudiarabia.com/fleet/bmw-7-series","1","Book a BMW 7 Series in Saudi Arabia from SAR 230. Executive luxury sedan with a smooth, powerful ride — perfect for business travel. Available 24/7 for airport transfers, Umrah, and intercity routes.","199","1223","Indexable",""
"https://taxisaudiarabia.com/blog/alula-travel-guide-hegra-dadan-transport","1","Discover Saudi Arabia's premier heritage destination. A guide to AlUla's top archaeological sites and the best ways to travel there.","132","800","Indexable",""
"https://taxisaudiarabia.com/routes/madinah-to-tabuk","1","Book a fixed-price taxi from Madinah to Tabuk — 620 km, approx 6h. From SAR 500, available 24/7 with licensed drivers. No surge, no hidden fees.","144","903","Indexable",""
"https://taxisaudiarabia.com/services/car-recovery/madinah","1","24/7 car recovery & flatbed tow truck (سطحة المدينة) in Madinah. Fast dispatch from SAR 250, fixed price on WhatsApp. Breakdown, accident & battery service across Madinah.","171","1072","Indexable",""
"https://taxisaudiarabia.com/fleet/luxury-bus","1","Book a Luxurious Bus in Saudi Arabia from SAR 800. Our largest coach for up to 25. On-board comfort and executive seating for big groups. Available 24/7 for airport transfers, Umrah, and intercity routes.","204","1256","Indexable",""
"https://taxisaudiarabia.com/routes/dammam-to-kuwait","1","Book a fixed-price taxi from Dammam to Kuwait City — 410 km, approx 4h. From SAR 600, available 24/7 with licensed drivers. No surge, no hidden fees.","149","940","Indexable",""
"https://taxisaudiarabia.com/fleet/cadillac-escalade","1","Book a Cadillac Escalade in Saudi Arabia from SAR 200. American luxury SUV for VIP arrivals. Premium audio, extra comfort, and a professional chauffeur. Available 24/7 for airport transfers, Umrah, and intercity routes.","219","1343","Indexable",""
"https://taxisaudiarabia.com/routes/jeddah-to-yanbu","1","Book a fixed-price taxi from Jeddah to Yanbu — 330 km, approx 3h. From SAR 300, available 24/7 with licensed drivers. No surge, no hidden fees.","143","897","Indexable",""
"https://taxisaudiarabia.com/routes/riyadh-to-hail","1","Book a fixed-price taxi from Riyadh to Hail — 600 km, approx 6h. From SAR 450, available 24/7 with licensed drivers. No surge, no hidden fees.","142","876","Indexable",""
"https://taxisaudiarabia.com/blog/complete-miqat-locations-guide-umrah-pilgrims","1","Understand the five official Miqat boundaries that pilgrims must cross in a state of Ihram before entering Makkah.","114","703","Indexable",""
"https://taxisaudiarabia.com/routes/makkah-to-jeddah","1","Book a fixed-price taxi from Makkah to Jeddah — 85 km, approx 1h. From SAR 150, available 24/7 with licensed drivers. No surge, no hidden fees.","143","898","Indexable",""
"https://taxisaudiarabia.com/driver-jobs/abha","1","Apply for driver jobs in Abha, Asir Province. Earn SAR 3,500–8,500/month with steady pre-booked trips, flexible hours and weekly payouts. Steady demand.","152","959","Indexable",""
"https://taxisaudiarabia.com/blog/what-is-a-satha-flatbed-tow-truck","1","Satha (سطحة) is the word every driver in Saudi Arabia needs to know. What a flatbed tow truck is, when you need one, what it costs, and how to call one fast in Riyadh, Jeddah, or Dammam.","186","1147","Indexable",""
"https://taxisaudiarabia.com/routes/riyadh-to-neom","1","Book a fixed-price taxi from Riyadh to NEOM — 1300 km, approx 12h. From SAR 1500, available 24/7 with licensed drivers. No surge, no hidden fees.","145","915","Indexable",""
"https://taxisaudiarabia.com/driver-jobs/najran","1","Apply for driver jobs in Najran, Najran Province. Earn SAR 3,500–8,000/month with steady pre-booked trips, flexible hours and weekly payouts. Steady demand.","156","983","Indexable",""
"https://taxisaudiarabia.com/fleet/mercedes-vito","1","Book a Mercedes Vito in Saudi Arabia from SAR 160. European business van with conference-style seats — ideal for corporate groups. Available 24/7 for airport transfers, Umrah, and intercity routes.","197","1223","Indexable",""
"https://taxisaudiarabia.com/routes/riyadh-to-alula","1","Book a fixed-price taxi from Riyadh to AlUla — 1050 km, approx 10h. From SAR 1000, available 24/7 with licensed drivers. No surge, no hidden fees.","146","909","Indexable",""
"https://taxisaudiarabia.com/driver-jobs/makkah","1","Apply for driver jobs in Makkah, Makkah Province. Earn SAR 5,000–13,000/month with steady pre-booked trips, flexible hours and weekly payouts. Very High demand.","160","1026","Indexable",""
"https://taxisaudiarabia.com/blog/jeddah-airport-to-makkah-complete-taxi-guide-2025","1","Everything you need to know about getting from King Abdulaziz International Airport (JED) to your hotel in Makkah for Umrah.","124","777","Indexable",""
"https://taxisaudiarabia.com/blog/flatbed-vs-hook-towing-automatic-cars","1","Towing an automatic, AWD, or luxury car the wrong way can destroy the transmission. Why flatbed (satha) is the only safe choice for modern cars — and when hook towing is acceptable.","181","1149","Indexable",""
"https://taxisaudiarabia.com/routes/taif-to-albaha","1","Book a fixed-price taxi from Taif to Al Baha — 220 km, approx 2h. From SAR 300, available 24/7 with licensed drivers. No surge, no hidden fees.","143","881","Indexable",""
"https://taxisaudiarabia.com/routes/jeddah-to-alula","1","Book a fixed-price taxi from Jeddah to AlUla — 700 km, approx 7h. From SAR 800, available 24/7 with licensed drivers. No surge, no hidden fees.","143","889","Indexable",""
"https://taxisaudiarabia.com/routes/madinah-to-yanbu","1","Book a fixed-price taxi from Madinah to Yanbu — 220 km, approx 2h. From SAR 200, available 24/7 with licensed drivers. No surge, no hidden fees.","144","904","Indexable",""
"https://taxisaudiarabia.com/driver-jobs/al-ahsa","1","Apply for driver jobs in Al-Ahsa, Eastern Province. Earn SAR 3,800–8,800/month with steady pre-booked trips, flexible hours and weekly payouts. High demand.","156","985","Indexable",""
"https://taxisaudiarabia.com/fleet/mercedes-s-class","1","Book a Mercedes S-Class in Saudi Arabia from SAR 250. The benchmark luxury sedan for executives and VIPs. Quiet, refined, and discreet. Available 24/7 for airport transfers, Umrah, and intercity routes.","202","1248","Indexable",""
"https://taxisaudiarabia.com/services/car-recovery/dammam","1","24/7 car recovery & flatbed tow truck (سطحة الدمام) in Dammam. Fast dispatch from SAR 200, fixed price on WhatsApp. Breakdown, accident & battery service across Dammam.","168","1078","Indexable",""
"https://taxisaudiarabia.com/routes/riyadh-to-alkhobar","1","Book a fixed-price taxi from Riyadh to Al Khobar — 400 km, approx 4h. From SAR 320, available 24/7 with licensed drivers. No surge, no hidden fees.","147","913","Indexable",""
"https://taxisaudiarabia.com/driver-jobs/khobar","1","Apply for driver jobs in Al Khobar, Eastern Province. Earn SAR 4,000–9,500/month with steady pre-booked trips, flexible hours and weekly payouts. High demand.","158","997","Indexable",""
"https://taxisaudiarabia.com/fleet/gmc-yukon-xl","1","Book a GMC Yukon XL / Denali in Saudi Arabia from SAR 150. Spacious executive SUV for families and VIP groups — extra legroom, big luggage space, and a smooth ride. Available 24/7 for airport transfers, Umrah, and intercity routes.","231","1441","Indexable",""
"https://taxisaudiarabia.com/driver-jobs/yanbu","1","Apply for driver jobs in Yanbu, Madinah Province. Earn SAR 3,800–8,800/month with steady pre-booked trips, flexible hours and weekly payouts. High demand.","154","983","Indexable",""
"https://taxisaudiarabia.com/routes/madinah-to-taif","1","Book a fixed-price taxi from Madinah to Taif — 480 km, approx 5h. From SAR 400, available 24/7 with licensed drivers. No surge, no hidden fees.","143","888","Indexable",""
"https://taxisaudiarabia.com/routes/jeddah-to-makkah","1","Book a fixed-price taxi from Jeddah City to Makkah — 85 km, approx 1h. From SAR 150, available 24/7 with licensed drivers. No surge, no hidden fees.","148","925","Indexable",""
"https://taxisaudiarabia.com/blog/neom-the-line-visiting-saudi-arabia-city-of-future","1","A guide to the Tabuk region and the developing NEOM giga-project. What can you see now and how to travel there.","111","710","Indexable",""
"https://taxisaudiarabia.com/chauffeur-jobs/dhahran","1","Apply for chauffeur jobs in Dhahran, Eastern Province. Drive VIP and corporate clients, earn SAR 5,000–11,900/month — the premium tier. Steady bookings, weekly payouts.","168","1064","Indexable",""
"https://taxisaudiarabia.com/chauffeur-jobs/jubail","1","Apply for chauffeur jobs in Jubail, Eastern Province. Drive VIP and corporate clients, earn SAR 5,000–11,900/month — the premium tier. Steady bookings, weekly payouts.","167","1049","Indexable",""
"https://taxisaudiarabia.com/taxi-driver-jobs/riyadh","1","Apply for taxi driver jobs in Riyadh, Riyadh Province. Everyday airport, city and intercity rides. Earn SAR 4,300–10,500/month with flexible hours and weekly payouts.","166","1011","Indexable",""
"https://taxisaudiarabia.com/chauffeur-jobs/abha","1","Apply for chauffeur jobs in Abha, Asir Province. Drive VIP and corporate clients, earn SAR 4,400–10,600/month — the premium tier. Steady bookings, weekly payouts.","162","1021","Indexable",""
"https://taxisaudiarabia.com/taxi-driver-jobs/madinah","1","Apply for taxi driver jobs in Madinah, Madinah Province. Everyday airport, city and intercity rides. Earn SAR 4,300–10,500/month with flexible hours and weekly payouts.","168","1035","Indexable",""
"https://taxisaudiarabia.com/airports/king-khalid-riyadh","1","Book your airport transfer from King Khalid International Airport. Reliable taxi service, fixed prices, and meet & greet included at RUH airport.","145","861","Indexable",""
"https://taxisaudiarabia.com/chauffeur-jobs/hail","1","Apply for chauffeur jobs in Hail, Hail Province. Drive VIP and corporate clients, earn SAR 4,400–10,000/month — the premium tier. Steady bookings, weekly payouts.","162","1012","Indexable",""
"https://taxisaudiarabia.com/taxi-driver-jobs/jeddah","1","Apply for taxi driver jobs in Jeddah, Makkah Province. Everyday airport, city and intercity rides. Earn SAR 4,300–11,400/month with flexible hours and weekly payouts.","166","1023","Indexable",""
"https://taxisaudiarabia.com/taxi-driver-jobs/dammam","1","Apply for taxi driver jobs in Dammam, Eastern Province. Everyday airport, city and intercity rides. Earn SAR 3,800–9,000/month with flexible hours and weekly payouts.","166","1027","Indexable",""
"https://taxisaudiarabia.com/services/hajj-transport","1","Dedicated Hajj transport services in Saudi Arabia. Reliable transfers during the peak pilgrimage season between Jeddah, Makkah, and Madinah.","140","887","Indexable",""
"https://taxisaudiarabia.com/chauffeur-jobs/jeddah","1","Apply for chauffeur jobs in Jeddah, Makkah Province. Drive VIP and corporate clients, earn SAR 5,600–15,000/month — the premium tier. Steady bookings, weekly payouts.","166","1060","Indexable",""
"https://taxisaudiarabia.com/taxi-driver-jobs/najran","1","Apply for taxi driver jobs in Najran, Najran Province. Everyday airport, city and intercity rides. Earn SAR 3,300–7,600/month with flexible hours and weekly payouts.","165","1001","Indexable",""
"https://taxisaudiarabia.com/taxi-driver-jobs/al-ahsa","1","Apply for taxi driver jobs in Al-Ahsa, Eastern Province. Everyday airport, city and intercity rides. Earn SAR 3,600–8,400/month with flexible hours and weekly payouts.","167","1015","Indexable",""
"https://taxisaudiarabia.com/taxi-driver-jobs/tabuk","1","Apply for taxi driver jobs in Tabuk, Tabuk Province. Everyday airport, city and intercity rides. Earn SAR 3,800–9,500/month with flexible hours and weekly payouts.","163","998","Indexable",""
"https://taxisaudiarabia.com/chauffeur-jobs/al-qassim","1","Apply for chauffeur jobs in Al-Qassim, Al-Qassim Province. Drive VIP and corporate clients, earn SAR 4,400–10,000/month — the premium tier. Steady bookings, weekly payouts.","172","1091","Indexable",""
"https://taxisaudiarabia.com/taxi-driver-jobs/jubail","1","Apply for taxi driver jobs in Jubail, Eastern Province. Everyday airport, city and intercity rides. Earn SAR 3,800–9,000/month with flexible hours and weekly payouts.","166","1005","Indexable",""
"https://taxisaudiarabia.com/chauffeur-jobs/al-ahsa","1","Apply for chauffeur jobs in Al-Ahsa, Eastern Province. Drive VIP and corporate clients, earn SAR 4,800–11,000/month — the premium tier. Steady bookings, weekly payouts.","168","1060","Indexable",""
"https://taxisaudiarabia.com/chauffeur-jobs/riyadh","1","Apply for chauffeur jobs in Riyadh, Riyadh Province. Drive VIP and corporate clients, earn SAR 5,600–13,800/month — the premium tier. Steady bookings, weekly payouts.","166","1048","Indexable",""
"https://taxisaudiarabia.com/chauffeur-jobs/khobar","1","Apply for chauffeur jobs in Al Khobar, Eastern Province. Drive VIP and corporate clients, earn SAR 5,000–11,900/month — the premium tier. Steady bookings, weekly payouts.","170","1072","Indexable",""
"https://taxisaudiarabia.com/taxi-driver-jobs/makkah","1","Apply for taxi driver jobs in Makkah, Makkah Province. Everyday airport, city and intercity rides. Earn SAR 4,800–12,400/month with flexible hours and weekly payouts.","166","1026","Indexable",""
"https://taxisaudiarabia.com/taxi-driver-jobs/khobar","1","Apply for taxi driver jobs in Al Khobar, Eastern Province. Everyday airport, city and intercity rides. Earn SAR 3,800–9,000/month with flexible hours and weekly payouts.","169","1027","Indexable",""
"https://taxisaudiarabia.com/chauffeur-jobs/khamis-mushait","1","Apply for chauffeur jobs in Khamis Mushait, Asir Province. Drive VIP and corporate clients, earn SAR 4,400–10,000/month — the premium tier. Steady bookings, weekly payouts.","172","1089","Indexable",""
"https://taxisaudiarabia.com/taxi-driver-jobs/buraidah","1","Apply for taxi driver jobs in Buraidah, Al-Qassim Province. Everyday airport, city and intercity rides. Earn SAR 3,300–7,600/month with flexible hours and weekly payouts.","170","1038","Indexable",""
"https://taxisaudiarabia.com/chauffeur-jobs/taif","1","Apply for chauffeur jobs in Taif, Makkah Province. Drive VIP and corporate clients, earn SAR 4,800–11,300/month — the premium tier. Steady bookings, weekly payouts.","164","1037","Indexable",""
"https://taxisaudiarabia.com/taxi-driver-jobs/dhahran","1","Apply for taxi driver jobs in Dhahran, Eastern Province. Everyday airport, city and intercity rides. Earn SAR 3,800–9,000/month with flexible hours and weekly payouts.","167","1019","Indexable",""
"https://taxisaudiarabia.com/chauffeur-jobs/makkah","1","Apply for chauffeur jobs in Makkah, Makkah Province. Drive VIP and corporate clients, earn SAR 6,300–16,300/month — the premium tier. Steady bookings, weekly payouts.","166","1063","Indexable",""
"https://taxisaudiarabia.com/taxi-driver-jobs/abha","1","Apply for taxi driver jobs in Abha, Asir Province. Everyday airport, city and intercity rides. Earn SAR 3,300–8,100/month with flexible hours and weekly payouts.","161","977","Indexable",""
"https://taxisaudiarabia.com/taxi-driver-jobs/hail","1","Apply for taxi driver jobs in Hail, Hail Province. Everyday airport, city and intercity rides. Earn SAR 3,300–7,600/month with flexible hours and weekly payouts.","161","967","Indexable",""
"https://taxisaudiarabia.com/chauffeur-jobs/najran","1","Apply for chauffeur jobs in Najran, Najran Province. Drive VIP and corporate clients, earn SAR 4,400–10,000/month — the premium tier. Steady bookings, weekly payouts.","166","1045","Indexable",""
"https://taxisaudiarabia.com/chauffeur-jobs/dammam","1","Apply for chauffeur jobs in Dammam, Eastern Province. Drive VIP and corporate clients, earn SAR 5,000–11,900/month — the premium tier. Steady bookings, weekly payouts.","167","1071","Indexable",""
"https://taxisaudiarabia.com/taxi-driver-jobs/khamis-mushait","1","Apply for taxi driver jobs in Khamis Mushait, Asir Province. Everyday airport, city and intercity rides. Earn SAR 3,300–7,600/month with flexible hours and weekly payouts.","171","1045","Indexable",""
"https://taxisaudiarabia.com/chauffeur-jobs/tabuk","1","Apply for chauffeur jobs in Tabuk, Tabuk Province. Drive VIP and corporate clients, earn SAR 5,000–12,500/month — the premium tier. Steady bookings, weekly payouts.","164","1043","Indexable",""
"https://taxisaudiarabia.com/chauffeur-jobs/buraidah","1","Apply for chauffeur jobs in Buraidah, Al-Qassim Province. Drive VIP and corporate clients, earn SAR 4,400–10,000/month — the premium tier. Steady bookings, weekly payouts.","171","1083","Indexable",""
"https://taxisaudiarabia.com/taxi-driver-jobs/yanbu","1","Apply for taxi driver jobs in Yanbu, Madinah Province. Everyday airport, city and intercity rides. Earn SAR 3,600–8,400/month with flexible hours and weekly payouts.","165","1013","Indexable",""
"https://taxisaudiarabia.com/chauffeur-jobs/yanbu","1","Apply for chauffeur jobs in Yanbu, Madinah Province. Drive VIP and corporate clients, earn SAR 4,800–11,000/month — the premium tier. Steady bookings, weekly payouts.","166","1058","Indexable",""
"https://taxisaudiarabia.com/airports/prince-mohammad-madinah","1","Book your airport transfer from Prince Mohammad Bin Abdulaziz Airport. Reliable taxi service, fixed prices, and meet & greet included at MED airport.","149","915","Indexable",""
"https://taxisaudiarabia.com/taxi-driver-jobs/taif","1","Apply for taxi driver jobs in Taif, Makkah Province. Everyday airport, city and intercity rides. Earn SAR 3,600–8,600/month with flexible hours and weekly payouts.","163","993","Indexable",""
"https://taxisaudiarabia.com/taxi-driver-jobs/al-qassim","1","Apply for taxi driver jobs in Al-Qassim, Al-Qassim Province. Everyday airport, city and intercity rides. Earn SAR 3,300–7,600/month with flexible hours and weekly payouts.","171","1046","Indexable",""
"https://taxisaudiarabia.com/chauffeur-jobs/madinah","1","Apply for chauffeur jobs in Madinah, Madinah Province. Drive VIP and corporate clients, earn SAR 5,600–13,800/month — the premium tier. Steady bookings, weekly payouts.","168","1072","Indexable",""
"https://taxisaudiarabia.com/taxi-driver-jobs","1","Taxi driver jobs across Saudi Arabia — everyday airport, city and intercity rides. Flexible hours, transparent fares and weekly payouts. Apply by city.","151","901","Indexable",""
"https://taxisaudiarabia.com/chauffeur-jobs","1","Professional chauffeur jobs across Saudi Arabia — drive VIP, corporate and luxury-fleet clients. The premium earnings tier with steady bookings and weekly payouts. Apply by city.","178","1102","Indexable",""
